{"$schema":"https://json-schema.org/draft/2020-12/schema","$id":"quantum-ai-convergence.schema.json","title":"Synthetic Quantum-AI Convergence Exercise","type":"object","required":["exercise_id","seed","algorithm","measurements","reference_map","fixture_threshold","bias_limit","quality","measurement_boundary","calibration","confidence","run_evidence","evidence_digest","human_boundary","handoff","fallback","run_evidence_id"],"properties":{"exercise_id":{"type":"string"},"seed":{"type":"integer"},"algorithm":{"const":"classical-nearest-map-value-v1"},"measurements":{"type":"array","minItems":1},"reference_map":{"type":"array","minItems":1},"fixture_threshold":{"type":"number"},"bias_limit":{"type":"number"},"quality":{"type":"object"},"measurement_boundary":{"type":"object"},"calibration":{"type":"object"},"confidence":{"type":"object"},"run_evidence":{"type":"object"},"evidence_digest":{"type":"string","pattern":"^sha256:[0-9a-f]{64}$"},"human_boundary":{"type":"object"},"handoff":{"type":"object"},"fallback":{"type":"object"},"run_evidence_id":{"type":"string"}}}
